{
  "schema_version": 2,
  "name": "a",
  "version": "0",
  "description": "x",
  "entrypoint": "bundle_controller:build",
  "when_to_use": "y",
  "python_path": ".",
  "config": {},
  "inputs_schema": {
    "type": [
      "object",
      "null"
    ],
    "additionalProperties": false
  },
  "config_schema": {
    "type": "object",
    "properties": {
      "n": {
        "type": "integer",
        "minimum": 0,
        "maximum": 10
      }
    }
  },
  "authorizations": [],
  "resources": {
    "keys": [],
    "exclusive": false
  },
  "stop": {
    "grace_seconds": 0.1
  },
  "scaffold": true
}
